{
  "schemaVersion": 2,
  "taskId": "FF-M02-004",
  "status": "NOT_READY",
  "title": "M02 API 契约验证、审计/基础通知与 E2E 收口",
  "track": "product-mainline",
  "stage": "M02",
  "roleType": "implementer",
  "specialty": "test",
  "goal": "在项目与 Brief 核心实现完成后，对齐受控批准的 OpenAPI，补齐后端 API/E2E、审计与基础站内通知，形成 M02 backend gate。",
  "readSet": [
    "docs/01-product/FrameFlow-PRD.md",
    "docs/02-architecture/**",
    "docs/03-data/project-data-dictionary.md",
    "docs/04-api/**",
    "docs/05-engineering/tasks/M02/FF-M02-003.json",
    "frameflow-modules/project/**",
    "frameflow-modules/identity/**"
  ],
  "writeSet": [
    "frameflow-modules/project/**",
    "frameflow-modules/governance/**",
    "frameflow-app/src/**",
    "scripts/m02/check-build.sh",
    "scripts/m02/check-api-contract.sh",
    "scripts/m02/check-e2e.sh",
    "evidence/m02/mvn-verify.txt",
    "evidence/m02/api-contract.txt",
    "evidence/m02/e2e.txt"
  ],
  "allowedCommands": [
    { "pattern": "sh scripts/m02/check-build.sh", "policy": "exact" },
    { "pattern": "sh scripts/m02/check-api-contract.sh", "policy": "exact" },
    { "pattern": "sh scripts/m02/check-e2e.sh", "policy": "exact" },
    { "pattern": "git status --short --branch", "policy": "exact" },
    { "pattern": "git diff --check", "policy": "exact" }
  ],
  "networkPolicy": {"allowExternal": false, "allowLocal": true, "allowRegistry": true},
  "toolCapabilities": ["repo-read", "repo-write", "git-read", "test-run", "docker"],
  "nonGoals": [
    "不修改 docs/04-api 或当前 Task Capsule",
    "不在权威 M02 OpenAPI 未受控批准时开始实现",
    "不实现前端、M03 任务、素材或审核/交付",
    "不引入 Redis、RabbitMQ、Kafka 或独立通知服务"
  ],
  "prerequisiteTaskIds": ["FF-M02-003"],
  "facts": [
    "FF-M02-003 当前为 NOT_READY，本任务不可派发",
    "MVP governance 模块尚无已验证的 audit_logs/notifications 业务实现",
    "M02 尚无已批准的权威 OpenAPI 变更"
  ],
  "decisions": [
    "运行时 springdoc 必须与受控批准的手写 OpenAPI 做完整功能差异比较",
    "governance 模块是 MVP audit_logs 和基础站内 notifications 的唯一 Mapper/表所有者",
    "业务模块只经 AuditPort/NotificationPort 或应用事件协作",
    "基础通知只包含站内持久化与已读状态，不包含自动外发邮件"
  ],
  "unknowns": [
    "审计事件清单、通知触发器、保留期与失败重试语义尚需 FF-M02-001 批准",
    "X-Correlation-Id 是否属于 M02 权威 OpenAPI 契约尚未批准"
  ],
  "techBoundary": {
    "allowed": ["Spring MVC", "springdoc", "PostgreSQL", "MockMvc", "Testcontainers", "AuditPort", "NotificationPort"],
    "forbidden": ["docs/04-api mutation", "Redis", "RabbitMQ", "Kafka", "external email", "frontend"]
  },
  "businessRules": [
    "所有后端响应含由后端为本次 attempt 生成的 X-Request-Id，错误 body requestId 同值",
    "跨请求关联使用单独 X-Correlation-Id，不得复用 X-Request-Id",
    "关键项目、成员和 Brief 变更必须可审计",
    "基础通知失败不得伪造核心业务成功或丢失已承诺的持久化状态"
  ],
  "acceptance": [
    {
      "acceptanceId": "AC-FF-M02-004-01",
      "criterion": "mvn clean verify 通过，模块边界、项目/Brief 业务、权限、事务、并发与迁移回归无失败",
      "testIds": ["TEST-FF-M02-004-01"],
      "evidenceIds": ["EV-FF-M02-004-01"]
    },
    {
      "acceptanceId": "AC-FF-M02-004-02",
      "criterion": "运行时 OpenAPI 与受控批准的手写 M02 契约无功能差异，X-Request-Id/X-Correlation-Id 按批准契约验证",
      "testIds": ["TEST-FF-M02-004-02"],
      "evidenceIds": ["EV-FF-M02-004-02"]
    },
    {
      "acceptanceId": "AC-FF-M02-004-03",
      "criterion": "M02 主流程 E2E 包含跨团队隔离、审计记录和基础站内通知，且无 Redis/MQ 依赖",
      "testIds": ["TEST-FF-M02-004-03", "TEST-FF-M02-004-04"],
      "evidenceIds": ["EV-FF-M02-004-03"]
    }
  ],
  "evidence": [
    {
      "evidenceId": "EV-FF-M02-004-01",
      "command": "sh scripts/m02/check-build.sh",
      "expected": "BUILD SUCCESS；M02 单元、架构、API 和集成测试全部通过",
      "outputRef": "evidence/m02/mvn-verify.txt"
    },
    {
      "evidenceId": "EV-FF-M02-004-02",
      "command": "sh scripts/m02/check-api-contract.sh",
      "expected": "运行时 OpenAPI 与受控契约功能差异为零",
      "outputRef": "evidence/m02/api-contract.txt"
    },
    {
      "evidenceId": "EV-FF-M02-004-03",
      "command": "sh scripts/m02/check-e2e.sh",
      "expected": "项目、成员、Brief、权限、审计和基础通知 E2E 通过",
      "outputRef": "evidence/m02/e2e.txt"
    }
  ],
  "requirementIds": ["REQ-PROJECT-001", "REQ-GOV-002"],
  "testIds": ["TEST-FF-M02-004-01", "TEST-FF-M02-004-02", "TEST-FF-M02-004-03", "TEST-FF-M02-004-04"],
  "rollback": "未获批准契约前不执行。失败时保留原始证据和工作树；已提交变更使用 git revert，不修改历史或删除共享数据。",
  "approvalPoints": [],
  "budget": {"maxFiles": 80, "maxCommands": 32, "maxMinutes": 300}
}
