{
  "schemaVersion": 2,
  "taskId": "FF-M01F-001",
  "status": "NOT_READY",
  "title": "M01-F 前端基座、BFF 认证与团队界面",
  "track": "product-mainline",
  "stage": "M01-F",
  "roleType": "implementer",
  "specialty": "security",
  "goal": "在本仓库 frameflow-web 建立可验证的 React/TypeScript/Next.js 基座，通过同源 BFF 安全实现认证与团队管理界面。",
  "readSet": [
    "README.md",
    "docs/01-product/FrameFlow-PRD.md",
    "docs/02-architecture/adr/ADR-012-前端技术选型.md",
    "docs/04-api/**",
    "docs/05-engineering/frontend-development.md",
    "docs/05-engineering/tasks/M01H/FF-M01H-001.json",
    "frameflow-app/**",
    "frameflow-modules/identity/**"
  ],
  "writeSet": [
    "frameflow-web/**",
    "evidence/m01f/**"
  ],
  "allowedCommands": [
    { "pattern": "npm ci", "policy": "exact" },
    { "pattern": "npm run lint", "policy": "exact" },
    { "pattern": "npm run typecheck", "policy": "exact" },
    { "pattern": "npm run test", "policy": "exact" },
    { "pattern": "npm run build", "policy": "exact" },
    { "pattern": "npm run verify", "policy": "exact" },
    { "pattern": "npm run test:e2e", "policy": "exact" },
    { "pattern": "FRAMEFLOW_WEB_EVIDENCE_DIR=evidence/m01f sh frameflow-web/scripts/check-verify.sh", "policy": "exact" },
    { "pattern": "FRAMEFLOW_WEB_EVIDENCE_DIR=evidence/m01f sh frameflow-web/scripts/check-security.sh", "policy": "exact" },
    { "pattern": "FRAMEFLOW_WEB_EVIDENCE_DIR=evidence/m01f sh frameflow-web/scripts/check-e2e.sh", "policy": "exact" },
    { "pattern": "git status --short --branch", "policy": "exact" },
    { "pattern": "git diff --check", "policy": "exact" }
  ],
  "networkPolicy": {
    "allowExternal": false,
    "allowLocal": true,
    "allowRegistry": true
  },
  "toolCapabilities": [
    "repo-read",
    "repo-write",
    "git-read",
    "test-run"
  ],
  "nonGoals": [
    "不创建独立前端仓库，不把 frameflow-web 加入 Maven reactor",
    "不修改 docs/04-api 权威契约",
    "不实现 M02 项目/Brief、M03 任务、M04 素材或 M08 审核/交付页面",
    "不将 Refresh Token 或 Access Token 写入 localStorage、sessionStorage 或 IndexedDB",
    "不信任前端 RBAC 作为安全决策"
  ],
  "prerequisiteTaskIds": [
    "FF-M01H-001"
  ],
  "facts": [
    "当前仓库尚无 frameflow-web 业务代码",
    "FF-M01H-001 当前为 IN_PROGRESS，因此本任务必须保持 NOT_READY",
    "后端是每次 HTTP attempt 的 X-Request-Id 权威生成方"
  ],
  "decisions": [
    "前端路径固定为本仓库 frameflow-web",
    "技术方向为 React、TypeScript、Next.js App Router/BFF、Tailwind CSS、shadcn/ui、TanStack Query、Zustand 和 openapi-typescript",
    "派发时选当时官方受支持的稳定版，并在 Task、package.json 和 lockfile 精确锁定",
    "Browser 只访问同源 Next BFF；Refresh Token 只存 Secure HttpOnly SameSite Cookie",
    "前端只展示权限结果，后端始终执行资源归属与 RBAC"
  ],
  "unknowns": [
    "派发时 Node.js、包管理器和核心前端依赖的具体受支持版本尚未锁定",
    "X-Correlation-Id 是否进入权威 OpenAPI 及其校验规则尚待 M02 Contract Gate 批准"
  ],
  "techBoundary": {
    "allowed": [
      "React",
      "TypeScript",
      "Next.js App Router and Route Handlers",
      "Tailwind CSS",
      "shadcn/ui",
      "TanStack Query",
      "Zustand",
      "openapi-typescript",
      "HttpOnly Cookie",
      "local browser E2E"
    ],
    "forbidden": [
      "orval",
      "Redux",
      "Refresh Token browser-readable storage",
      "browser direct API token handling",
      "independent frontend repository",
      "M02 or later business UI"
    ]
  },
  "businessRules": [
    "Refresh Token 不得出现在浏览器 JavaScript、日志、Evidence 或错误上报中",
    "BFF 状态变更路由必须实施 CSRF 防护",
    "后端响应 X-Request-Id 仅用于当次请求报错，不得被前端重用为业务 ID",
    "无权资源保持后端 404 语义，不因前端隐藏按钮而降低后端校验"
  ],
  "acceptance": [
    {
      "acceptanceId": "AC-FF-M01F-001-01",
      "criterion": "frameflow-web 在本仓库内使用派发时锁定的受支持版本，lint、typecheck、test 与 build 全部通过",
      "testIds": ["TEST-FF-M01F-001-01"],
      "evidenceIds": ["EV-FF-M01F-001-01"]
    },
    {
      "acceptanceId": "AC-FF-M01F-001-02",
      "criterion": "Next BFF 完成登录、刷新与登出；Refresh Token 只在 HttpOnly Cookie，浏览器可读存储与输出中无 Token",
      "testIds": ["TEST-FF-M01F-001-02", "TEST-FF-M01F-001-03"],
      "evidenceIds": ["EV-FF-M01F-001-02"]
    },
    {
      "acceptanceId": "AC-FF-M01F-001-03",
      "criterion": "登录/注册/团队与成员主流程 E2E 通过，且 401/403/404 与 X-Request-Id 展示语义与后端一致",
      "testIds": ["TEST-FF-M01F-001-04", "TEST-FF-M01F-001-05"],
      "evidenceIds": ["EV-FF-M01F-001-03"]
    },
    {
      "acceptanceId": "AC-FF-M01F-001-04",
      "criterion": "openapi-typescript 从权威 YAML 生成类型，仓库内无 orval 或重复手写 API schema",
      "testIds": ["TEST-FF-M01F-001-06"],
      "evidenceIds": ["EV-FF-M01F-001-01"]
    }
  ],
  "evidence": [
    {
      "evidenceId": "EV-FF-M01F-001-01",
      "command": "FRAMEFLOW_WEB_EVIDENCE_DIR=evidence/m01f sh frameflow-web/scripts/check-verify.sh",
      "expected": "精确锁版本的前端 lint/type/test/build 联合门禁通过，openapi-typescript 生成结果无漂移",
      "outputRef": "evidence/m01f/build.txt"
    },
    {
      "evidenceId": "EV-FF-M01F-001-02",
      "command": "FRAMEFLOW_WEB_EVIDENCE_DIR=evidence/m01f sh frameflow-web/scripts/check-security.sh",
      "expected": "BFF Cookie、Token 轮换、CSRF 与浏览器存储安全测试通过",
      "outputRef": "evidence/m01f/security-tests.txt"
    },
    {
      "evidenceId": "EV-FF-M01F-001-03",
      "command": "FRAMEFLOW_WEB_EVIDENCE_DIR=evidence/m01f sh frameflow-web/scripts/check-e2e.sh",
      "expected": "认证、团队、成员、错误语义和 requestId 展示 E2E 通过",
      "outputRef": "evidence/m01f/e2e.txt"
    }
  ],
  "requirementIds": [
    "REQ-FRONTEND-001",
    "REQ-IAM-001"
  ],
  "testIds": [
    "TEST-FF-M01F-001-01",
    "TEST-FF-M01F-001-02",
    "TEST-FF-M01F-001-03",
    "TEST-FF-M01F-001-04",
    "TEST-FF-M01F-001-05",
    "TEST-FF-M01F-001-06"
  ],
  "rollback": "停止派发并保留现场；若已提交则使用可审计 git revert，不修改 Java 模块或删除共享工作树。",
  "approvalPoints": [
    {
      "action": "锁定派发时的 Node.js、包管理器与核心前端依赖精确版本",
      "approvalType": "local",
      "reason": "需以派发日的官方支持窗口与本地运行环境为准"
    }
  ],
  "budget": {
    "maxFiles": 80,
    "maxCommands": 30,
    "maxMinutes": 240
  }
}
