{
  "schemaVersion": 2,
  "taskId": "FF-P0-001",
  "status": "IN_PROGRESS",
  "title": "工程基座：Git、Maven 多模块、Spring Boot、PostgreSQL Compose",
  "track": "product-mainline",
  "stage": "P0",
  "roleType": "implementer",
  "specialty": "general",
  "goal": "建立可复现的 Java 模块化单体工程基座：Git 初始化、Maven 多模块、Spring Boot 3.4.5、PostgreSQL 16 Compose、Flyway、/health 与 /readiness。",
  "readSet": [
    "README.md",
    "docs/00-governance/project-status.md",
    "docs/00-governance/documentation-policy.md",
    "docs/01-product/FrameFlow-PRD.md",
    "docs/02-architecture/FrameFlow-概要设计.md",
    "docs/02-architecture/adr/**",
    "docs/03-data/FrameFlow-详细设计.md",
    "docs/04-api/api-guidelines.md",
    "docs/04-api/error-code-catalog.md",
    "docs/05-engineering/development-plan-p0-m17.md",
    "docs/05-engineering/task-capsule-spec.md",
    "docs/05-engineering/local-development.md"
  ],
  "writeSet": [
    "README.md",
    "pom.xml",
    "mvnw",
    "mvnw.cmd",
    ".mvn/**",
    "frameflow-app/**",
    "frameflow-modules/**",
    "frameflow-shared-kernel/**",
    "docker-compose.local.yml",
    ".env.example",
    ".gitattributes",
    ".gitignore",
    ".github/workflows/ci.yml",
    "scripts/p0/**",
    "evidence/p0/**",
    "docs/00-governance/project-status.md",
    "docs/05-engineering/task-capsule-catalog.md",
    "docs/05-engineering/generated/task-capsule-index.md",
    "docs/09-delivery/evidence-index.md"
  ],
  "allowedCommands": [
    { "pattern": "mvn -B clean verify", "policy": "exact" },
    { "pattern": "mvn -B -DskipTests validate", "policy": "exact" },
    { "pattern": "mvn -B test", "policy": "exact" },
    { "pattern": "docker compose -f docker-compose.local.yml config", "policy": "exact" },
    { "pattern": "docker compose -f docker-compose.local.yml up -d --wait", "policy": "exact" },
    { "pattern": "sh scripts/p0/check-health.sh", "policy": "exact" },
    { "pattern": "sh scripts/p0/check-readiness-db-down.sh", "policy": "exact" },
    { "pattern": "sh scripts/p0/check-readiness-db-up.sh", "policy": "exact" },
    { "pattern": "sh scripts/p0/check-flyway.sh", "policy": "exact" },
    { "pattern": "sh scripts/p0/check-repo-hygiene.sh", "policy": "exact" },
    { "pattern": "sh scripts/p0/check-build.sh", "policy": "exact" },
    { "pattern": "mvn -N org.apache.maven.plugins:maven-wrapper-plugin:3.3.2:wrapper -Dmaven=3.9.6 -Dtype=only-script", "policy": "exact" },
    { "pattern": "git init -b main", "policy": "exact" },
    { "pattern": "git switch -c feat/ff-p0-001", "policy": "exact" },
    { "pattern": "git status", "policy": "exact" },
    { "pattern": "git add -A", "policy": "exact" },
    { "pattern": "git commit -m", "policy": "prefix" },
    { "pattern": "java -version", "policy": "exact" },
    { "pattern": "mvn -version", "policy": "exact" }
  ],
  "networkPolicy": {
    "allowExternal": false,
    "allowLocal": true,
    "allowRegistry": true
  },
  "toolCapabilities": ["repo-read", "repo-write", "git-read", "test-run", "docker", "mcp-read"],
  "nonGoals": [
    "不引入 Redis、MinIO、RabbitMQ、Kafka",
    "不引入 Spring Cloud、Kubernetes、Istio",
    "不实现 M01 业务（用户/团队/认证）",
    "不创建前端",
    "不读取或复制 jcm_media_api 任何内容",
    "不修改 docs/04-api 下的权威契约"
  ],
  "prerequisiteTaskIds": ["FF-PP-001"],
  "facts": [
    "当前仓库为开发前治理基线，仅有文档、任务协议、P0-Prep 校验脚本与原始证据，业务开发进度为 0",
    "P0-Prep 门禁（FF-PP-001）已通过才允许本任务派发",
    "初始化 Git 与执行 P0 是两个独立审批点；FF-PP-001 DONE 后两项均获用户明确授权，调度器才可将本任务改为 READY_FOR_DISPATCH",
    "Git 初始化和首个 baseline commit 是 P0 派发后的首个受审批动作；该 commit 由 P0 Receipt/Evidence 记录为 PP pre-Git 当前态的后继锚点，不重写 PP 原始证据",
    "开发机必须为 JDK 17（本机 17.0.18；配套 Spring Boot 3.4.5 与 Java 17 兼容）",
    "Docker daemon 可用性以 docker version 实际结果为准"
  ],
  "decisions": [
    "仓库采用模式 A：源码单仓库",
    "PostgreSQL 是 MVP 唯一事务主库（ADR-002）",
    "JDK 17 唯一基线；Spring Boot 3.4.5（支持 Java 17）；PostgreSQL 16-alpine；Maven Wrapper 3.9.x",
    "Flyway 版本由 Spring Boot BOM 管理，不单独锁定",
    "任务/证据编号遵循 task-capsule.schema.json v2"
  ],
  "unknowns": [],
  "techBoundary": {
    "allowed": ["Java 17", "Maven Wrapper", "Spring Boot 3.4.5", "Spring MVC", "JUnit 5", "PostgreSQL 16", "Flyway", "Docker Compose", "Git"],
    "forbidden": ["Redis", "MinIO", "RabbitMQ", "Kafka", "Spring Cloud", "Kubernetes", "Istio", "前端"]
  },
  "businessRules": [
    "PRD：/health 不依赖数据库，/readiness 反映必要依赖可用性",
    "PRD：不提交 .env、真实密钥、target、IDE 私有文件"
  ],
  "acceptance": [
    { "acceptanceId": "AC-FF-P0-001-01", "criterion": "mvn -B clean verify 通过", "testIds": ["TEST-FF-P0-001-01"], "evidenceIds": ["EV-FF-P0-001-01"] },
    { "acceptanceId": "AC-FF-P0-001-02", "criterion": "GET /health 返回 200 与 {\"status\":\"UP\"}，不依赖数据库", "testIds": ["TEST-FF-P0-001-02"], "evidenceIds": ["EV-FF-P0-001-02"] },
    { "acceptanceId": "AC-FF-P0-001-03", "criterion": "数据库停机时 GET /readiness 返回 503 与 NOT_READY", "testIds": ["TEST-FF-P0-001-03"], "evidenceIds": ["EV-FF-P0-001-03"] },
    { "acceptanceId": "AC-FF-P0-001-04", "criterion": "数据库启动后 GET /readiness 返回 200 与 READY", "testIds": ["TEST-FF-P0-001-04"], "evidenceIds": ["EV-FF-P0-001-04"] },
    { "acceptanceId": "AC-FF-P0-001-05", "criterion": "空库从 V1 迁移到最新；再次 migrate 为 no-op（无额外变更）", "testIds": ["TEST-FF-P0-001-05"], "evidenceIds": ["EV-FF-P0-001-05"] },
    { "acceptanceId": "AC-FF-P0-001-06", "criterion": "仓库卫生脚本通过 git ls-files、git check-ignore、git archive 和 git status 证明敏感/生成/平台垃圾未被跟踪，且本地 .zcode 保留但被忽略、未跟踪并不进入归档", "testIds": ["TEST-FF-P0-001-06"], "evidenceIds": ["EV-FF-P0-001-06"] }
  ],
  "evidence": [
    { "evidenceId": "EV-FF-P0-001-01", "command": "sh scripts/p0/check-build.sh", "expected": "脚本原样执行 mvn -B clean verify，退出码为 0、BUILD SUCCESS 且测试未跳过，并保存完整脱敏输出", "outputRef": "evidence/p0/mvn-verify.txt" },
    { "evidenceId": "EV-FF-P0-001-02", "command": "sh scripts/p0/check-health.sh", "expected": "200 与 {\"status\":\"UP\"}", "outputRef": "evidence/p0/health.txt" },
    { "evidenceId": "EV-FF-P0-001-03", "command": "sh scripts/p0/check-readiness-db-down.sh", "expected": "数据库停止期间返回 503 与 NOT_READY，脚本结束时恢复数据库", "outputRef": "evidence/p0/readiness-db-down.txt" },
    { "evidenceId": "EV-FF-P0-001-04", "command": "sh scripts/p0/check-readiness-db-up.sh", "expected": "等待 PostgreSQL 健康后返回 200 与 READY", "outputRef": "evidence/p0/readiness-db-up.txt" },
    { "evidenceId": "EV-FF-P0-001-05", "command": "sh scripts/p0/check-flyway.sh", "expected": "隔离空库从 V1 迁移到最新，重复执行无变更", "outputRef": "evidence/p0/flyway-migrate.txt" },
    { "evidenceId": "EV-FF-P0-001-06", "command": "sh scripts/p0/check-repo-hygiene.sh", "expected": "git ls-files 未发现 .zcode、密钥、.env、生成物或平台垃圾；git check-ignore 确认 .zcode 被忽略；git archive 清单不含 .zcode；git status 结果已记录且不掩盖已跟踪违规项", "outputRef": "evidence/p0/repo-hygiene.txt" }
  ],
  "requirementIds": ["REQ-ENG-001"],
  "testIds": [
    "TEST-FF-P0-001-01",
    "TEST-FF-P0-001-02",
    "TEST-FF-P0-001-03",
    "TEST-FF-P0-001-04",
    "TEST-FF-P0-001-05",
    "TEST-FF-P0-001-06"
  ],
  "rollback": "在独立任务分支执行；失败时停止执行、保留现场和失败证据，已有独立提交只用 git revert 回退；禁止 reset、删除 .git 或覆盖共享工作区改动",
  "approvalPoints": [
    { "action": "git-init", "approvalType": "irreversible", "reason": "创建独立 Git 仓库，必须取得用户明确授权后执行" },
    { "action": "p0-execution", "approvalType": "local", "reason": "开始创建工程基座与运行本地验证，必须取得用户对执行 P0 的明确授权" },
    { "action": "compose-up", "approvalType": "local", "reason": "启动本地隔离 PostgreSQL（可逆）" },
    { "action": "first-migration", "approvalType": "local", "reason": "首次执行 Flyway 迁移（本地库，可重建）" }
  ],
  "budget": {
    "maxFiles": 60,
    "maxCommands": 40,
    "maxMinutes": 240
  }
}
