{
  "schemaVersion": 2,
  "taskId": "FF-M04F-001",
  "status": "DRAFT",
  "title": "M04-F 项目、任务与素材前端",
  "track": "product-mainline",
  "stage": "M04-F",
  "roleType": "implementer",
  "specialty": "code",
  "goal": "在 M02、M03 与 M04-A backend gate 全部完成后，扩展本仓库 frameflow-web，交付项目/Brief、任务/评论与素材版本界面。",
  "readSet": [
    "docs/01-product/FrameFlow-PRD.md",
    "docs/02-architecture/adr/ADR-012-前端技术选型.md",
    "docs/04-api/**",
    "docs/05-engineering/frontend-development.md",
    "docs/05-engineering/tasks/M01F/FF-M01F-001.json",
    "docs/05-engineering/tasks/M02/FF-M02-004.json",
    "frameflow-web/**"
  ],
  "writeSet": ["frameflow-web/**", "evidence/m04f/**"],
  "allowedCommands": [
    { "pattern": "npm ci", "policy": "exact" },
    { "pattern": "npm run verify", "policy": "exact" },
    { "pattern": "npm run test:e2e", "policy": "exact" },
    { "pattern": "FRAMEFLOW_WEB_EVIDENCE_DIR=evidence/m04f sh frameflow-web/scripts/check-verify.sh", "policy": "exact" },
    { "pattern": "FRAMEFLOW_WEB_EVIDENCE_DIR=evidence/m04f sh frameflow-web/scripts/check-e2e.sh", "policy": "exact" },
    { "pattern": "git status --short --branch", "policy": "exact" },
    { "pattern": "git diff --check", "policy": "exact" }
  ],
  "networkPolicy": {"allowExternal": false, "allowLocal": true, "allowRegistry": true},
  "toolCapabilities": ["repo-read", "repo-write", "git-read", "test-run"],
  "nonGoals": [
    "不在 FF-M03-001 和 FF-M04A-001 Task Capsule 实际建立并 DONE 前离开 DRAFT",
    "不修改 docs/04-api 权威契约",
    "不实现浏览器视频编辑器、M08 审核/交付界面或后端业务",
    "不将 Refresh Token 写入浏览器可读存储"
  ],
  "prerequisiteTaskIds": ["FF-M01F-001", "FF-M02-004"],
  "facts": [
    "FF-M03-001 和 FF-M04A-001 当前仅是 PLANNED 条目，没有可引用的 Task Capsule",
    "为避免悬空 prerequisiteTaskIds，本 DRAFT 暂只引用已存在的 M01-F 和 M02 收口任务",
    "本任务不可派发"
  ],
  "decisions": [
    "本阶段的完整业务前置是 M02、M03 与 M04-A DONE，且继承 M01-F",
    "FF-M03-001 和 FF-M04A-001 文件建立后，必须将它们补入 prerequisiteTaskIds 并复核状态，否则始终不可派发",
    "继续使用 Next BFF、HttpOnly Cookie、TanStack Query 和 openapi-typescript"
  ],
  "unknowns": [
    "FF-M03-001 与 FF-M04A-001 的实际 Task Capsule、精确 API 契约和 DONE 证据尚不存在",
    "派发时前端受支持版本与精确 UI 验收数据尚未锁定"
  ],
  "techBoundary": {
    "allowed": ["React", "TypeScript", "Next.js BFF", "Tailwind CSS", "shadcn/ui", "TanStack Query", "Zustand", "openapi-typescript", "browser E2E"],
    "forbidden": ["orval", "Refresh Token browser-readable storage", "video editor", "backend implementation", "docs/04-api mutation"]
  },
  "businessRules": [
    "项目/成员/Brief 权限和 404 防枚举以后端为准",
    "Brief 历史版本只读，current 切换显示后端并发冲突",
    "任务乐观锁 409 和非法状态转换不得在前端吞掉",
    "素材版本不可覆盖，上传/失败/补偿状态必须可见"
  ],
  "acceptance": [
    {
      "acceptanceId": "AC-FF-M04F-001-01",
      "criterion": "精确锁版本的 frameflow-web lint/type/test/build 全部通过，openapi-typescript 生成无漂移",
      "testIds": ["TEST-FF-M04F-001-01"],
      "evidenceIds": ["EV-FF-M04F-001-01"]
    },
    {
      "acceptanceId": "AC-FF-M04F-001-02",
      "criterion": "项目/Brief、任务/评论、素材版本主流程及跨团队、版本冲突和上传失败 E2E 通过",
      "testIds": ["TEST-FF-M04F-001-02", "TEST-FF-M04F-001-03", "TEST-FF-M04F-001-04"],
      "evidenceIds": ["EV-FF-M04F-001-02"]
    }
  ],
  "evidence": [
    {
      "evidenceId": "EV-FF-M04F-001-01",
      "command": "FRAMEFLOW_WEB_EVIDENCE_DIR=evidence/m04f sh frameflow-web/scripts/check-verify.sh",
      "expected": "lint、typecheck、unit test、production build 与 OpenAPI 生成漂移门禁通过",
      "outputRef": "evidence/m04f/verify.txt"
    },
    {
      "evidenceId": "EV-FF-M04F-001-02",
      "command": "FRAMEFLOW_WEB_EVIDENCE_DIR=evidence/m04f sh frameflow-web/scripts/check-e2e.sh",
      "expected": "项目/Brief、任务/评论与素材前端 E2E 通过",
      "outputRef": "evidence/m04f/e2e.txt"
    }
  ],
  "requirementIds": ["REQ-FRONTEND-001", "REQ-PROJECT-001"],
  "testIds": ["TEST-FF-M04F-001-01", "TEST-FF-M04F-001-02", "TEST-FF-M04F-001-03", "TEST-FF-M04F-001-04"],
  "rollback": "未补齐 M03/M04-A 实际前置前不执行。失败时保留原始证据；已提交前端变更使用 git revert，不删除共享工作树。",
  "approvalPoints": [],
  "budget": {"maxFiles": 100, "maxCommands": 35, "maxMinutes": 300}
}
