{
  "schemaVersion": 2,
  "taskId": "FF-M02-002",
  "status": "NOT_READY",
  "title": "M02 项目、客户与项目成员基座",
  "track": "product-mainline",
  "stage": "M02",
  "roleType": "implementer",
  "specialty": "code",
  "goal": "在 M02 Contract Gate 与权威 API 另行获批准后，以 PostgreSQL 实现客户、项目和项目成员的数据、应用与权限基座。",
  "readSet": [
    "README.md",
    "docs/01-product/FrameFlow-PRD.md",
    "docs/02-architecture/**",
    "docs/03-data/project-data-dictionary.md",
    "docs/04-api/**",
    "docs/05-engineering/tasks/M02/FF-M02-001.json",
    "frameflow-modules/identity/**",
    "frameflow-shared-kernel/**"
  ],
  "writeSet": [
    "frameflow-modules/project/**",
    "frameflow-app/src/main/resources/db/migration/V4__project_workspace.sql",
    "frameflow-app/src/test/**",
    "scripts/m02/**",
    "evidence/m02/project-foundation.txt",
    "evidence/m02/migration.txt"
  ],
  "allowedCommands": [
    { "pattern": "./mvnw -B clean verify", "policy": "exact" },
    { "pattern": "./mvnw -B -pl frameflow-app -am test", "policy": "exact" },
    { "pattern": "sh scripts/m02/check-project-foundation.sh", "policy": "exact" },
    { "pattern": "sh scripts/m02/check-migration.sh", "policy": "exact" },
    { "pattern": "git status --short --branch", "policy": "exact" },
    { "pattern": "git diff --check", "policy": "exact" }
  ],
  "networkPolicy": {
    "allowExternal": false,
    "allowLocal": true,
    "allowRegistry": true
  },
  "toolCapabilities": ["repo-read", "repo-write", "git-read", "test-run", "docker"],
  "nonGoals": [
    "不在 Contract Gate 或权威 OpenAPI 未批准时开始实现",
    "不修改 docs/04-api 或当前 Task Capsule",
    "不实现 Brief 版本、M03 任务、素材或前端",
    "不引入 Redis、消息队列或微服务"
  ],
  "prerequisiteTaskIds": ["FF-M02-001"],
  "facts": [
    "FF-M02-001 当前为 DRAFT，本任务因此为 NOT_READY",
    "当前无 project 业务模块与 M02 数据迁移",
    "V3 若保留，M02 第一个迁移必须是 V4"
  ],
  "decisions": [
    "Project 模块拥有 clients、projects、project_members 与其幂等事实",
    "CLIENT 是项目级角色，不进入 team_members.role",
    "数据库唯一约束、应用事务和后端权限共同保证正确性",
    "端点实现只能对齐后续受控批准的 docs/04-api 契约"
  ],
  "unknowns": [
    "FF-M02-001 列出的 Client、权限、API、幂等、错误与审计决策尚未批准",
    "权威 M02 OpenAPI 尚未在另行受控任务中更新并通过契约审查"
  ],
  "techBoundary": {
    "allowed": ["JDK 17", "Spring Boot 3.4.5", "PostgreSQL", "Flyway V4", "MyBatis-Plus/XML", "JUnit 5", "Testcontainers", "ArchUnit"],
    "forbidden": ["Redis", "message queue", "microservices", "frontend", "docs/04-api mutation"]
  },
  "businessRules": [
    "项目属于一个 Team，跨团队资源不可枚举",
    "project_members 角色为 PROJECT_MANAGER、CONTRIBUTOR、VIEWER、CLIENT，精确权限以获批准矩阵为准",
    "DELIVERED 项目不得直接删除，ARCHIVED 默认只读",
    "并发创建/成员变更必须返回稳定契约错误，不得暴露唯一约束 500"
  ],
  "acceptance": [
    {
      "acceptanceId": "AC-FF-M02-002-01",
      "criterion": "V4 在隔离空库从 V1/V2/V3 forward-only 迁移成功，重复启动 no-op，且表/约束精确对齐获批准数据字典",
      "testIds": ["TEST-FF-M02-002-01"],
      "evidenceIds": ["EV-FF-M02-002-02"]
    },
    {
      "acceptanceId": "AC-FF-M02-002-02",
      "criterion": "客户、项目与项目成员的后端权限、事务、幂等、并发冲突和 401/403/404/409 语义全部通过",
      "testIds": ["TEST-FF-M02-002-02", "TEST-FF-M02-002-03", "TEST-FF-M02-002-04"],
      "evidenceIds": ["EV-FF-M02-002-01"]
    }
  ],
  "evidence": [
    {
      "evidenceId": "EV-FF-M02-002-01",
      "command": "sh scripts/m02/check-project-foundation.sh",
      "expected": "项目基座 API、权限、事务、幂等和并发错误语义全部通过",
      "outputRef": "evidence/m02/project-foundation.txt"
    },
    {
      "evidenceId": "EV-FF-M02-002-02",
      "command": "sh scripts/m02/check-migration.sh",
      "expected": "V1 至 V4 在隔离库 forward-only 成功且重复启动 no-op",
      "outputRef": "evidence/m02/migration.txt"
    }
  ],
  "requirementIds": ["REQ-PROJECT-001", "REQ-GOV-002"],
  "testIds": ["TEST-FF-M02-002-01", "TEST-FF-M02-002-02", "TEST-FF-M02-002-03", "TEST-FF-M02-002-04"],
  "rollback": "未获批准前不执行。执行后若失败，保留 forward-only 迁移现场与原始证据，在隔离开发库重建；已提交代码使用 git revert，不修改历史。",
  "approvalPoints": [],
  "budget": {"maxFiles": 70, "maxCommands": 30, "maxMinutes": 300}
}
