{
  "schemaVersion": 2,
  "taskId": "FF-M02-001",
  "status": "DRAFT",
  "title": "M02 项目与 Brief Contract Gate",
  "track": "product-mainline",
  "stage": "M02",
  "roleType": "architect",
  "specialty": "general",
  "goal": "在不写 M02 业务代码且不修改当前权威 OpenAPI 的前提下，收敛项目与 Brief 的数据、API、权限、测试和 Evidence 决策并取得用户批准。",
  "readSet": [
    "README.md",
    "docs/00-governance/project-status.md",
    "docs/01-product/FrameFlow-PRD.md",
    "docs/02-architecture/**",
    "docs/03-data/**",
    "docs/04-api/**",
    "docs/05-engineering/task-capsule-spec.md",
    "docs/05-engineering/tasks/M01H/FF-M01H-001.json",
    "docs/06-testing/**",
    "frameflow-app/src/main/resources/db/migration/**"
  ],
  "writeSet": [
    "docs/03-data/project-data-dictionary.md",
    "docs/05-engineering/registries/**",
    "docs/06-testing/**",
    "scripts/m02/check-contract-gate.sh",
    "evidence/m02/contract-gate.txt"
  ],
  "allowedCommands": [
    { "pattern": "sh scripts/m02/check-contract-gate.sh", "policy": "exact" },
    { "pattern": "git status --short --branch", "policy": "exact" },
    { "pattern": "git diff --check", "policy": "exact" }
  ],
  "networkPolicy": {
    "allowExternal": false,
    "allowLocal": false,
    "allowRegistry": false
  },
  "toolCapabilities": [
    "repo-read",
    "repo-write",
    "git-read",
    "docs-index"
  ],
  "nonGoals": [
    "不写 Java、SQL migration、前端或运行时业务脚本；只允许编写本 Contract Gate 的确定性校验脚本",
    "不修改 docs/04-api/openapi/frameflow-v1.yaml 或其他权威 API 契约",
    "不将 project-data-dictionary.md 草案冒充定稿",
    "不派发 FF-M02-002 至 FF-M02-004",
    "不引入 Redis、MinIO、RabbitMQ 或微服务"
  ],
  "prerequisiteTaskIds": [
    "FF-M01H-001"
  ],
  "facts": [
    "FF-M01-001 功能已合并，但 FF-M01H-001 仍为 IN_PROGRESS",
    "当前 docs/04-api/openapi/frameflow-v1.yaml 只是 M01 权威契约，不具备 M02 完整 endpoint 与 schema",
    "当前工作树保留 V3__table_and_column_comments.sql；若它保留，后续 M02 迁移必须从 V4 开始",
    "M02 尚无获批准的完整数据字典、权限矩阵、API 与 Evidence 契约"
  ],
  "decisions": [
    "本任务是 Contract Gate 而非实现任务",
    "MVP 唯一事务主库是 PostgreSQL，Project 模块拥有 clients/projects/project_members/brief_versions",
    "一个项目同时最多一个 current Brief，并发正确性必须由应用事务和数据库约束共同保证",
    "governance 模块是 MVP audit_logs 和基础站内 notifications 的唯一表所有者",
    "X-Request-Id 由后端为每次 HTTP attempt 生成，跨请求关联另用 X-Correlation-Id"
  ],
  "unknowns": [
    "Client 数据是否必须关联 Identity user 与其个人数据保留规则",
    "TeamRole 与 ProjectRole 的精确权限矩阵和隐式访问规则",
    "M02 endpoint、payload、分页、幂等、错误码和 401/403/404/409 语义",
    "Project 状态命令与 Brief 内容 schema、current 切换和并发冲突语义",
    "X-Correlation-Id 的校验、生成方和 OpenAPI 契约",
    "审计事件、基础站内通知触发器、保留期和失败语义"
  ],
  "techBoundary": {
    "allowed": [
      "Markdown contract drafts",
      "PostgreSQL schema proposals",
      "permission matrix design",
      "Requirement Acceptance Test Evidence mapping",
      "deterministic Contract Gate validation script"
    ],
    "forbidden": [
      "Java implementation",
      "SQL migration implementation",
      "docs/04-api mutation",
      "frontend implementation",
      "Redis",
      "message queue"
    ]
  },
  "businessRules": [
    "Project 必须属于 Team，所有项目资源都能追溯 team_id",
    "CLIENT 是项目级角色，不进入 team_members.role",
    "一个项目同时最多一个 current Brief",
    "DELIVERED 项目不得直接删除，ARCHIVED 默认只读",
    "关键变更必须有后端权限、明确错误语义、审计与可验证证据"
  ],
  "acceptance": [
    {
      "acceptanceId": "AC-FF-M02-001-01",
      "criterion": "数据字典区分 FACT/DECISION/PROPOSAL/UNKNOWN，并对 clients/projects/project_members/brief_versions、V4 迁移起点和并发约束形成可批准决策表",
      "testIds": ["TEST-FF-M02-001-01"],
      "evidenceIds": ["EV-FF-M02-001-01"]
    },
    {
      "acceptanceId": "AC-FF-M02-001-02",
      "criterion": "API、权限、错误、幂等、request/correlation ID、审计与基础通知决策逐项获用户批准",
      "testIds": ["TEST-FF-M02-001-02", "TEST-FF-M02-001-03"],
      "evidenceIds": ["EV-FF-M02-001-01"]
    },
    {
      "acceptanceId": "AC-FF-M02-001-03",
      "criterion": "Requirement/Test/Acceptance/Evidence 映射可解析且无悬空引用，但本 Gate 不冒充 docs/04 OpenAPI 已更新",
      "testIds": ["TEST-FF-M02-001-04"],
      "evidenceIds": ["EV-FF-M02-001-01"]
    }
  ],
  "evidence": [
    {
      "evidenceId": "EV-FF-M02-001-01",
      "command": "sh scripts/m02/check-contract-gate.sh",
      "expected": "Contract Gate 输入、Task/Registry 引用和文档状态可解析；所有 UNKNOWN 有明确审批结论后才可离开 DRAFT",
      "outputRef": "evidence/m02/contract-gate.txt"
    }
  ],
  "requirementIds": [
    "REQ-PROJECT-001",
    "REQ-GOV-002"
  ],
  "testIds": [
    "TEST-FF-M02-001-01",
    "TEST-FF-M02-001-02",
    "TEST-FF-M02-001-03",
    "TEST-FF-M02-001-04"
  ],
  "rollback": "本任务只修改草案与注册表；拒绝或暂缓时保留 DRAFT/UNKNOWN 现场，不删除 V3、不回滚已完成任务且不改 Git 历史。",
  "approvalPoints": [
    {
      "action": "批准 M02 数据、API、权限、测试、审计/基础通知与 Evidence 决策",
      "approvalType": "local",
      "reason": "这些决策会实质冻结 M02 实现边界，必须由用户最终批准"
    }
  ],
  "budget": {
    "maxFiles": 8,
    "maxCommands": 10,
    "maxMinutes": 120
  }
}
