{
  "schemaVersion": 2,
  "taskId": "FF-M08F-001",
  "status": "DRAFT",
  "title": "M08-F 审核交付前端与产品 MVP Gate",
  "track": "product-mainline",
  "stage": "M08-F",
  "roleType": "implementer",
  "specialty": "test",
  "goal": "在 M07 AI suggestion 与 M08 后端审核交付门禁完成后，交付审核、批注、基础通知、交付包和客户确认界面，并用全栈 E2E 形成真实用户验证前的产品 MVP Gate。",
  "readSet": [
    "docs/01-product/FrameFlow-PRD.md",
    "docs/02-architecture/**",
    "docs/04-api/**",
    "docs/05-engineering/frontend-development.md",
    "docs/05-engineering/tasks/M04F/FF-M04F-001.json",
    "docs/06-testing/**",
    "frameflow-web/**"
  ],
  "writeSet": ["frameflow-web/**", "evidence/m08f/**"],
  "allowedCommands": [
    { "pattern": "npm ci", "policy": "exact" },
    { "pattern": "npm run verify", "policy": "exact" },
    { "pattern": "npm run test:e2e", "policy": "exact" },
    { "pattern": "FRAMEFLOW_WEB_EVIDENCE_DIR=evidence/m08f sh frameflow-web/scripts/check-verify.sh", "policy": "exact" },
    { "pattern": "FRAMEFLOW_WEB_EVIDENCE_DIR=evidence/m08f sh frameflow-web/scripts/check-e2e.sh", "policy": "exact" },
    { "pattern": "git status --short --branch", "policy": "exact" },
    { "pattern": "git diff --check", "policy": "exact" }
  ],
  "networkPolicy": {"allowExternal": false, "allowLocal": true, "allowRegistry": true},
  "toolCapabilities": ["repo-read", "repo-write", "git-read", "test-run"],
  "nonGoals": [
    "不在 FF-M07-001 和 FF-M08-001 Task Capsule 实际建立并 DONE 前离开 DRAFT",
    "不修改 docs/04-api 权威契约或后端业务",
    "不实现浏览器视频编辑器、实时协同编辑、移动 App 或外发邮件",
    "不在本 Gate 通过前宣称 MVP 可用或开始真实用户验证",
    "不将可选 M05 Redis 当作本任务前置"
  ],
  "prerequisiteTaskIds": ["FF-M04F-001"],
  "facts": [
    "FF-M07-001 和 FF-M08-001 当前仅是 PLANNED 条目，没有可引用的 Task Capsule",
    "M08 定义为 backend gate，不等于产品 MVP Gate",
    "真实用户验证只能在 M08-F 全部验收通过之后开始",
    "本任务不可派发"
  ],
  "decisions": [
    "本阶段必须继承 M04-F，并直接依赖 M07 与 M08 DONE",
    "FF-M07-001 和 FF-M08-001 文件建立后，必须将它们补入 prerequisiteTaskIds 并复核状态",
    "M08-F 是 product MVP gate，覆盖前端可用性、BFF 安全边界、审计/基础通知和全栈 E2E",
    "M05 Redis 是可选 engineering-lab，不得阻塞本 Gate"
  ],
  "unknowns": [
    "FF-M07-001 和 FF-M08-001 的实际 Task Capsule、权威 API 和 DONE 证据尚不存在",
    "首个真实试用对象、媒体规格、外部交付链接/水印限制尚未批准",
    "派发时前端受支持版本与可用性测试数据尚未锁定"
  ],
  "techBoundary": {
    "allowed": ["React", "TypeScript", "Next.js BFF", "Tailwind CSS", "shadcn/ui", "TanStack Query", "Zustand", "openapi-typescript", "browser E2E", "accessibility testing"],
    "forbidden": ["Redis prerequisite", "orval", "Refresh Token browser-readable storage", "video editor", "real-time collaborative editor", "external email", "docs/04-api mutation"]
  },
  "businessRules": [
    "AI 输出只能作为 suggestion，必须明示人工确认后才生效",
    "审核通过后的修改必须创建新版本并重新审核",
    "交付包固定引用素材版本，授权过期素材不可进入新交付包",
    "客户确认必须幂等并可审计",
    "基础通知只做站内持久化/已读，所有权属 governance 模块",
    "后端为每次 attempt 生成 X-Request-Id；跨请求关联使用 X-Correlation-Id"
  ],
  "acceptance": [
    {
      "acceptanceId": "AC-FF-M08F-001-01",
      "criterion": "精确锁版本的 frameflow-web lint/type/test/build、OpenAPI 生成漂移与 accessibility 门禁全部通过",
      "testIds": ["TEST-FF-M08F-001-01", "TEST-FF-M08F-001-02"],
      "evidenceIds": ["EV-FF-M08F-001-01"]
    },
    {
      "acceptanceId": "AC-FF-M08F-001-02",
      "criterion": "上传至 AI suggestion、批注/审核/返工、交付包、客户幂等确认、锁定、审计和基础通知的全栈 E2E 通过",
      "testIds": ["TEST-FF-M08F-001-03", "TEST-FF-M08F-001-04", "TEST-FF-M08F-001-05"],
      "evidenceIds": ["EV-FF-M08F-001-02"]
    },
    {
      "acceptanceId": "AC-FF-M08F-001-03",
      "criterion": "BFF HttpOnly Cookie、CSRF、Refresh 轮换、X-Request-Id/X-Correlation-Id 和跨团队 404 安全边界通过，仓库无 Token 泄漏",
      "testIds": ["TEST-FF-M08F-001-06"],
      "evidenceIds": ["EV-FF-M08F-001-02"]
    }
  ],
  "evidence": [
    {
      "evidenceId": "EV-FF-M08F-001-01",
      "command": "FRAMEFLOW_WEB_EVIDENCE_DIR=evidence/m08f sh frameflow-web/scripts/check-verify.sh",
      "expected": "lint、typecheck、unit test、production build、OpenAPI 漂移与 accessibility 门禁通过",
      "outputRef": "evidence/m08f/verify.txt"
    },
    {
      "evidenceId": "EV-FF-M08F-001-02",
      "command": "FRAMEFLOW_WEB_EVIDENCE_DIR=evidence/m08f sh frameflow-web/scripts/check-e2e.sh",
      "expected": "完整产品闭环、审计/通知、BFF 安全和错误语义 E2E 通过，可进入真实用户验证",
      "outputRef": "evidence/m08f/product-e2e.txt"
    }
  ],
  "requirementIds": ["REQ-FRONTEND-001", "REQ-REVIEW-001", "REQ-GOV-002"],
  "testIds": ["TEST-FF-M08F-001-01", "TEST-FF-M08F-001-02", "TEST-FF-M08F-001-03", "TEST-FF-M08F-001-04", "TEST-FF-M08F-001-05", "TEST-FF-M08F-001-06"],
  "rollback": "未补齐 M07/M08 实际前置前不执行。失败时保留原始证据与用户验证禁止标记；已提交变更使用 git revert，不删除共享数据或修改 Git 历史。",
  "approvalPoints": [
    {
      "action": "在 M08-F 全部 Evidence PASS 后批准开始真实用户验证",
      "approvalType": "release",
      "reason": "真实用户验证可能涉及外部人员、数据和素材，必须在 product MVP Gate 后单独授权"
    }
  ],
  "budget": {"maxFiles": 120, "maxCommands": 40, "maxMinutes": 360}
}
